<?xml version='1.0' encoding='UTF-8'?>

<!--
    TODO define vocabulary identification
    PUBLIC ID: -//vendor//vocabulary//EN
    SYSTEM ID: http://server/path/actividad-ej-3.dtd

-->

<!--
    An example how to use this DTD from your XML document:

    <?xml version="1.0"?>

    <!DOCTYPE Almacen-Concesionario SYSTEM "actividad-ej-3.dtd">

    <Almacen-Concesionario>
    ...
    </Almacen-Concesionario>
-->

<!--- Put your DTDDoc comment here. -->
<!ELEMENT Almacen-Concesionario (coche)*>

<!--- Put your DTDDoc comment here. -->
<!ELEMENT coche (codigo-coche|marca|modelo|matricula|caballos|plazas|nPuertas)*>

<!--- Put your DTDDoc comment here. -->
<!ELEMENT codigo-coche (#PCDATA)>

<!--- Put your DTDDoc comment here. -->
<!ELEMENT marca (#PCDATA)>

<!--- Put your DTDDoc comment here. -->
<!ELEMENT modelo (#PCDATA)>

<!--- Put your DTDDoc comment here. -->
<!ELEMENT matricula (#PCDATA)>

<!--- Put your DTDDoc comment here. -->
<!ELEMENT caballos (#PCDATA)>

<!--- Put your DTDDoc comment here. -->
<!ELEMENT plazas (#PCDATA)>

<!--- Put your DTDDoc comment here. -->
<!ELEMENT nPuertas (#PCDATA)>
